{"$schema":"https://json-schema.org/draft/2020-12/schema","$id":"metrics.schema.json","type":"object","required":["schema_version","updated_at","engineering","control_plane","tests","coverage","tooling","release"],"properties":{"$schema":{"type":"string"},"schema_version":{"type":"string","const":"1.0.0"},"updated_at":{"type":"string"},"engineering":{"type":"object","required":["requirements_total","acceptance_total","work_items_total"]},"control_plane":{"type":"object","required":["tool_tests_total","tool_tests_passed","schema_documents_validated","requirements_traced"]},"tests":{"type":"object","required":["methods","passed","failed","errors","skipped"]},"coverage":{"type":"object"},"tooling":{"type":"object"},"release":{"type":"object","required":["ready","full_green_streak"]}},"additionalProperties":false}
